{
  "schema_version": "wiringmap.v0",
  "meta": {
    "repo": "wiring-and-the-whole",
    "ref": "witness/toybank",
    "slice": "loans/",
    "notes": "Hand-populated from witness/toybank/loans/*.java refs comments; edge-recall wedge sample."
  },
  "junctions": [
    {
      "id": "junction:shared.PageDto",
      "label": "shared.PageDto#of",
      "junction_kind": "dto"
    },
    {
      "id": "junction:shared.AuditDto",
      "label": "shared.AuditDto#log",
      "junction_kind": "dto"
    },
    {
      "id": "junction:shared.EventTopics",
      "label": "shared.EventTopics#EVT",
      "junction_kind": "topic"
    }
  ],
  "units": [
    {
      "id": "unit:loans.LoansController",
      "path": "witness/toybank/loans/LoansController.java",
      "role": "HTTP adapter — list/get loans",
      "ports": [
        {
          "id": "port:loans.LoansController#list",
          "symbol": "list",
          "kind": "method",
          "signature_stub": "Page list(int p)",
          "exported": true
        },
        {
          "id": "port:loans.LoansController#get",
          "symbol": "get",
          "kind": "method",
          "signature_stub": "Dto get(long id)",
          "exported": true
        },
        {
          "id": "port:loans.LoansController#log",
          "symbol": "log",
          "kind": "method",
          "signature_stub": "void log(String m)",
          "exported": false
        }
      ]
    },
    {
      "id": "unit:loans.LoansService",
      "path": "witness/toybank/loans/LoansService.java",
      "role": "Application service — page and single fetch",
      "ports": [
        {
          "id": "port:loans.LoansService#fetchPage",
          "symbol": "fetchPage",
          "kind": "method",
          "signature_stub": "Page fetchPage(int p)",
          "exported": true
        },
        {
          "id": "port:loans.LoansService#fetchOne",
          "symbol": "fetchOne",
          "kind": "method",
          "signature_stub": "Dto fetchOne(long id)",
          "exported": true
        }
      ]
    },
    {
      "id": "unit:loans.LoansRepository",
      "path": "witness/toybank/loans/LoansRepository.java",
      "role": "Persistence — page and single find",
      "ports": [
        {
          "id": "port:loans.LoansRepository#findPage",
          "symbol": "findPage",
          "kind": "method",
          "signature_stub": "Page findPage(int p)",
          "exported": true
        },
        {
          "id": "port:loans.LoansRepository#findOne",
          "symbol": "findOne",
          "kind": "method",
          "signature_stub": "Dto findOne(long id)",
          "exported": true
        }
      ]
    }
  ],
  "edges": [
    {
      "id": "edge:ctrl-svc-page",
      "from": "port:loans.LoansController#list",
      "to": "port:loans.LoansService#fetchPage",
      "edge_kind": "call",
      "doctrine_tag": "system_map",
      "evidence": "LoansController.java // refs: loans.LoansService#fetchPage"
    },
    {
      "id": "edge:ctrl-svc-one",
      "from": "port:loans.LoansController#get",
      "to": "port:loans.LoansService#fetchOne",
      "edge_kind": "call",
      "doctrine_tag": "system_map",
      "evidence": "LoansController.java // refs: loans.LoansService#fetchOne"
    },
    {
      "id": "edge:ctrl-audit",
      "from": "port:loans.LoansController#log",
      "to": "junction:shared.AuditDto",
      "edge_kind": "ref",
      "doctrine_tag": "junction",
      "evidence": "LoansController.java // refs: shared.AuditDto#log"
    },
    {
      "id": "edge:ctrl-page-dto",
      "from": "port:loans.LoansController#list",
      "to": "junction:shared.PageDto",
      "edge_kind": "ref",
      "doctrine_tag": "junction",
      "evidence": "LoansController.java // refs: shared.PageDto#of"
    },
    {
      "id": "edge:svc-repo-page",
      "from": "port:loans.LoansService#fetchPage",
      "to": "port:loans.LoansRepository#findPage",
      "edge_kind": "call",
      "doctrine_tag": "system_map",
      "evidence": "LoansService.java // refs: loans.LoansRepository#findPage"
    },
    {
      "id": "edge:svc-repo-one",
      "from": "port:loans.LoansService#fetchOne",
      "to": "port:loans.LoansRepository#findOne",
      "edge_kind": "call",
      "doctrine_tag": "system_map",
      "evidence": "LoansService.java // refs: loans.LoansRepository#findOne"
    },
    {
      "id": "edge:svc-event-topic",
      "from": "unit:loans.LoansService",
      "to": "junction:shared.EventTopics",
      "edge_kind": "ref",
      "doctrine_tag": "junction",
      "evidence": "LoansService.java // refs: shared.EventTopics#EVT"
    },
    {
      "id": "edge:repo-page-dto",
      "from": "port:loans.LoansRepository#findPage",
      "to": "junction:shared.PageDto",
      "edge_kind": "ref",
      "doctrine_tag": "junction",
      "evidence": "LoansRepository.java // refs: shared.PageDto#of"
    }
  ]
}
